[
  {
    "iso2": "AD",
    "supportsMultiCurrency": false,
    "settlementCurrency": "EUR",
    "minorUnits": 2,
    "updatedAt": "2026-06-10"
  },
  {
    "iso2": "AE",
    "supportsMultiCurrency": false,
    "settlementCurrency": "AED",
    "minorUnits": 2,
    "updatedAt": "2026-06-10"
  },
  {
    "iso2": "AF",
    "supportsMultiCurrency": false,
    "settlementCurrency": "AFN",
    "minorUnits": 2,
    "updatedAt": "2026-06-10"
  },
  {
    "iso2": "AG",
    "supportsMultiCurrency": false,
    "settlementCurrency": "XCD",
    "minorUnits": 2,
    "updatedAt": "2026-06-10"
  },
  {
    "iso2": "AI",
    "supportsMultiCurrency": false,
    "settlementCurrency": "XCD",
    "minorUnits": 2,
    "updatedAt": "2026-06-10"
  },
  {
    "iso2": "AL",
    "supportsMultiCurrency": false,
    "settlementCurrency": "ALL",
    "minorUnits": 2,
    "updatedAt": "2026-06-10"
  },
  {
    "iso2": "AM",
    "supportsMultiCurrency": false,
    "settlementCurrency": "AMD",
    "minorUnits": 2,
    "updatedAt": "2026-06-10"
  },
  {
    "iso2": "AO",
    "supportsMultiCurrency": false,
    "settlementCurrency": "AOA",
    "minorUnits": 2,
    "updatedAt": "2026-06-10"
  },
  {
    "iso2": "AQ",
    "supportsMultiCurrency": false,
    "settlementCurrency": "XXX",
    "minorUnits": 2,
    "updatedAt": "2026-06-10"
  },
  {
    "iso2": "AR",
    "supportsMultiCurrency": false,
    "settlementCurrency": "ARS",
    "minorUnits": 2,
    "updatedAt": "2026-06-10"
  },
  {
    "iso2": "AS",
    "supportsMultiCurrency": false,
    "settlementCurrency": "USD",
    "minorUnits": 2,
    "updatedAt": "2026-06-10"
  },
  {
    "iso2": "AT",
    "supportsMultiCurrency": false,
    "settlementCurrency": "EUR",
    "minorUnits": 2,
    "updatedAt": "2026-06-10"
  },
  {
    "iso2": "AU",
    "supportsMultiCurrency": false,
    "settlementCurrency": "AUD",
    "minorUnits": 2,
    "updatedAt": "2026-06-10"
  },
  {
    "iso2": "AW",
    "supportsMultiCurrency": false,
    "settlementCurrency": "AWG",
    "minorUnits": 2,
    "updatedAt": "2026-06-10"
  },
  {
    "iso2": "AX",
    "supportsMultiCurrency": false,
    "settlementCurrency": "EUR",
    "minorUnits": 2,
    "updatedAt": "2026-06-10"
  },
  {
    "iso2": "AZ",
    "supportsMultiCurrency": false,
    "settlementCurrency": "AZN",
    "minorUnits": 2,
    "updatedAt": "2026-06-10"
  },
  {
    "iso2": "BA",
    "supportsMultiCurrency": false,
    "settlementCurrency": "BAM",
    "minorUnits": 2,
    "updatedAt": "2026-06-10"
  },
  {
    "iso2": "BB",
    "supportsMultiCurrency": false,
    "settlementCurrency": "BBD",
    "minorUnits": 2,
    "updatedAt": "2026-06-10"
  },
  {
    "iso2": "BD",
    "supportsMultiCurrency": false,
    "settlementCurrency": "BDT",
    "minorUnits": 2,
    "updatedAt": "2026-06-10"
  },
  {
    "iso2": "BE",
    "supportsMultiCurrency": false,
    "settlementCurrency": "EUR",
    "minorUnits": 2,
    "updatedAt": "2026-06-10"
  },
  {
    "iso2": "BF",
    "supportsMultiCurrency": false,
    "settlementCurrency": "XOF",
    "minorUnits": 2,
    "updatedAt": "2026-06-10"
  },
  {
    "iso2": "BG",
    "supportsMultiCurrency": false,
    "settlementCurrency": "EUR",
    "minorUnits": 2,
    "updatedAt": "2026-06-10"
  },
  {
    "iso2": "BH",
    "supportsMultiCurrency": false,
    "settlementCurrency": "BHD",
    "minorUnits": 2,
    "updatedAt": "2026-06-10"
  },
  {
    "iso2": "BI",
    "supportsMultiCurrency": false,
    "settlementCurrency": "BIF",
    "minorUnits": 2,
    "updatedAt": "2026-06-10"
  },
  {
    "iso2": "BJ",
    "supportsMultiCurrency": false,
    "settlementCurrency": "XOF",
    "minorUnits": 2,
    "updatedAt": "2026-06-10"
  },
  {
    "iso2": "BL",
    "supportsMultiCurrency": false,
    "settlementCurrency": "EUR",
    "minorUnits": 2,
    "updatedAt": "2026-06-10"
  },
  {
    "iso2": "BM",
    "supportsMultiCurrency": false,
    "settlementCurrency": "BMD",
    "minorUnits": 2,
    "updatedAt": "2026-06-10"
  },
  {
    "iso2": "BN",
    "supportsMultiCurrency": false,
    "settlementCurrency": "BND",
    "minorUnits": 2,
    "updatedAt": "2026-06-10"
  },
  {
    "iso2": "BO",
    "supportsMultiCurrency": false,
    "settlementCurrency": "BOB",
    "minorUnits": 2,
    "updatedAt": "2026-06-10"
  },
  {
    "iso2": "BR",
    "supportsMultiCurrency": false,
    "settlementCurrency": "BRL",
    "minorUnits": 2,
    "updatedAt": "2026-06-10"
  },
  {
    "iso2": "BS",
    "supportsMultiCurrency": false,
    "settlementCurrency": "BSD",
    "minorUnits": 2,
    "updatedAt": "2026-06-10"
  },
  {
    "iso2": "BT",
    "supportsMultiCurrency": false,
    "settlementCurrency": "BTN",
    "minorUnits": 2,
    "updatedAt": "2026-06-10"
  },
  {
    "iso2": "BW",
    "supportsMultiCurrency": false,
    "settlementCurrency": "BWP",
    "minorUnits": 2,
    "updatedAt": "2026-06-10"
  },
  {
    "iso2": "BY",
    "supportsMultiCurrency": false,
    "settlementCurrency": "BYN",
    "minorUnits": 2,
    "updatedAt": "2026-06-10"
  },
  {
    "iso2": "BZ",
    "supportsMultiCurrency": false,
    "settlementCurrency": "BZD",
    "minorUnits": 2,
    "updatedAt": "2026-06-10"
  },
  {
    "iso2": "CA",
    "supportsMultiCurrency": false,
    "settlementCurrency": "CAD",
    "minorUnits": 2,
    "updatedAt": "2026-06-10"
  },
  {
    "iso2": "CC",
    "supportsMultiCurrency": false,
    "settlementCurrency": "AUD",
    "minorUnits": 2,
    "updatedAt": "2026-06-10"
  },
  {
    "iso2": "CD",
    "supportsMultiCurrency": false,
    "settlementCurrency": "CDF",
    "minorUnits": 2,
    "updatedAt": "2026-06-10"
  },
  {
    "iso2": "CF",
    "supportsMultiCurrency": false,
    "settlementCurrency": "XAF",
    "minorUnits": 2,
    "updatedAt": "2026-06-10"
  },
  {
    "iso2": "CG",
    "supportsMultiCurrency": false,
    "settlementCurrency": "XAF",
    "minorUnits": 2,
    "updatedAt": "2026-06-10"
  },
  {
    "iso2": "CH",
    "supportsMultiCurrency": false,
    "settlementCurrency": "CHF",
    "minorUnits": 2,
    "updatedAt": "2026-06-10"
  },
  {
    "iso2": "CI",
    "supportsMultiCurrency": false,
    "settlementCurrency": "XOF",
    "minorUnits": 2,
    "updatedAt": "2026-06-10"
  },
  {
    "iso2": "CK",
    "supportsMultiCurrency": false,
    "settlementCurrency": "NZD",
    "minorUnits": 2,
    "updatedAt": "2026-06-10"
  },
  {
    "iso2": "CL",
    "supportsMultiCurrency": false,
    "settlementCurrency": "CLP",
    "minorUnits": 2,
    "updatedAt": "2026-06-10"
  },
  {
    "iso2": "CM",
    "supportsMultiCurrency": false,
    "settlementCurrency": "XAF",
    "minorUnits": 2,
    "updatedAt": "2026-06-10"
  },
  {
    "iso2": "CN",
    "supportsMultiCurrency": false,
    "settlementCurrency": "CNY",
    "minorUnits": 2,
    "updatedAt": "2026-06-10"
  },
  {
    "iso2": "CO",
    "supportsMultiCurrency": false,
    "settlementCurrency": "COP",
    "minorUnits": 2,
    "updatedAt": "2026-06-10"
  },
  {
    "iso2": "CR",
    "supportsMultiCurrency": false,
    "settlementCurrency": "CRC",
    "minorUnits": 2,
    "updatedAt": "2026-06-10"
  },
  {
    "iso2": "CU",
    "supportsMultiCurrency": false,
    "settlementCurrency": "CUP",
    "minorUnits": 2,
    "updatedAt": "2026-06-10"
  },
  {
    "iso2": "CV",
    "supportsMultiCurrency": false,
    "settlementCurrency": "CVE",
    "minorUnits": 2,
    "updatedAt": "2026-06-10"
  },
  {
    "iso2": "CW",
    "supportsMultiCurrency": false,
    "settlementCurrency": "XCG",
    "minorUnits": 2,
    "updatedAt": "2026-06-10"
  },
  {
    "iso2": "CX",
    "supportsMultiCurrency": false,
    "settlementCurrency": "AUD",
    "minorUnits": 2,
    "updatedAt": "2026-06-10"
  },
  {
    "iso2": "CY",
    "supportsMultiCurrency": false,
    "settlementCurrency": "EUR",
    "minorUnits": 2,
    "updatedAt": "2026-06-10"
  },
  {
    "iso2": "CZ",
    "supportsMultiCurrency": false,
    "settlementCurrency": "CZK",
    "minorUnits": 2,
    "updatedAt": "2026-06-10"
  },
  {
    "iso2": "DE",
    "supportsMultiCurrency": false,
    "settlementCurrency": "EUR",
    "minorUnits": 2,
    "updatedAt": "2026-06-10"
  },
  {
    "iso2": "DJ",
    "supportsMultiCurrency": false,
    "settlementCurrency": "DJF",
    "minorUnits": 2,
    "updatedAt": "2026-06-10"
  },
  {
    "iso2": "DK",
    "supportsMultiCurrency": false,
    "settlementCurrency": "DKK",
    "minorUnits": 2,
    "updatedAt": "2026-06-10"
  },
  {
    "iso2": "DM",
    "supportsMultiCurrency": false,
    "settlementCurrency": "XCD",
    "minorUnits": 2,
    "updatedAt": "2026-06-10"
  },
  {
    "iso2": "DO",
    "supportsMultiCurrency": false,
    "settlementCurrency": "DOP",
    "minorUnits": 2,
    "updatedAt": "2026-06-10"
  },
  {
    "iso2": "DZ",
    "supportsMultiCurrency": false,
    "settlementCurrency": "DZD",
    "minorUnits": 2,
    "updatedAt": "2026-06-10"
  },
  {
    "iso2": "EC",
    "supportsMultiCurrency": false,
    "settlementCurrency": "USD",
    "minorUnits": 2,
    "updatedAt": "2026-06-10"
  },
  {
    "iso2": "EE",
    "supportsMultiCurrency": false,
    "settlementCurrency": "EUR",
    "minorUnits": 2,
    "updatedAt": "2026-06-10"
  },
  {
    "iso2": "EG",
    "supportsMultiCurrency": false,
    "settlementCurrency": "EGP",
    "minorUnits": 2,
    "updatedAt": "2026-06-10"
  },
  {
    "iso2": "EH",
    "supportsMultiCurrency": false,
    "settlementCurrency": "MAD",
    "minorUnits": 2,
    "updatedAt": "2026-06-10"
  },
  {
    "iso2": "ER",
    "supportsMultiCurrency": false,
    "settlementCurrency": "ERN",
    "minorUnits": 2,
    "updatedAt": "2026-06-10"
  },
  {
    "iso2": "ES",
    "supportsMultiCurrency": false,
    "settlementCurrency": "EUR",
    "minorUnits": 2,
    "updatedAt": "2026-06-10"
  },
  {
    "iso2": "ET",
    "supportsMultiCurrency": false,
    "settlementCurrency": "ETB",
    "minorUnits": 2,
    "updatedAt": "2026-06-10"
  },
  {
    "iso2": "FI",
    "supportsMultiCurrency": false,
    "settlementCurrency": "EUR",
    "minorUnits": 2,
    "updatedAt": "2026-06-10"
  },